{"anchor_id":"QUALITYCI_SYNTHETIC_ROOT_2026","contract_version":"qualityci-authorization-trust-snapshot-0.1","issued_at":"2024-02-02T00:00:00Z","issuer_keys":[{"allowed_purpose_codes":["APPLY_APPROVED_RESOLUTION"],"allowed_role_claims":["PROCESS_OWNER"],"allowed_scope_codes":["EXACT_SUBJECT"],"effective_from":"2023-01-01T00:00:00Z","expires_at":"2030-01-01T00:00:00Z","issuer_id":"ISSUER-QCI-SYN-PO","public_key":"zfR2PV810FNhWir85vMNLApO5CgxElsEX3yhlO9CL7E=","revocation_status":"ACTIVE","revoked_at":null,"verification_key_id":"KEY-QCI-SYN-PO-001"},{"allowed_purpose_codes":["APPLY_APPROVED_RESOLUTION"],"allowed_role_claims":["QUALITY_MANAGER"],"allowed_scope_codes":["EXACT_SUBJECT"],"effective_from":"2023-01-01T00:00:00Z","expires_at":"2030-01-01T00:00:00Z","issuer_id":"ISSUER-QCI-SYN-QM","public_key":"cEMo82wH5hrLJgC5Pc98k59mPk0z3/CFD6nYlsjiOy0=","revocation_status":"ACTIVE","revoked_at":null,"verification_key_id":"KEY-QCI-SYN-QM-001"}],"signature":"ezLwhIAl8MYCFgO8kKEgRmIOhiBTdyaaLPwwXK3abSaM8tji/uXiYgwFyTlukG5JIKQOb9j9ODQnqmTPvHj4Bg==","signature_algorithm":"ED25519","snapshot_id":"QCI-SYNTHETIC-TRUST-2026-001","snapshot_sequence":1,"trust_domain":"QUALITYCI_SYNTHETIC_LOCAL_V1"}